Paper no;Paper name;Venue;Year;Abstract
50;"PassionNet: An Innovative Framework for
Duplicate and Conflicting Requirements
Identification";Arxiv;2024;"Early detection and resolution of duplicate and conflicting requirements
can significantly enhance project e!ciency and overall software qual-
ity. Researchers have developed various computational predictors by
leveraging Artificial Intelligence (AI) potential to detect duplicate and
conflicting requirements. However, these predictors lack in performance
and requires more e""ective approaches to empower software development
processes. Following the need of a unique predictor that can accurately
identify duplicate and conflicting requirements, this research o""ers a
comprehensive framework that facilitate development of 3 di""erent types
of predictive pipelines: language models based, multi-model similarity
knowledge-driven and large language models (LLMs) context + multi-
model similarity knowledge-driven. Within first type predictive pipelines
landscape, framework facilitates conflicting/duplicate requirements iden-
tification by leveraging 8 distinct types of LLMs. In second type, frame-
work supports development of predictive pipelines that leverage multi-
scale and multi-model similarity knowledge, ranging from traditional
similarity computation methods to advanced similarity vectors gener-
ated by LLMs. In the third type, the framework synthesizes predictive
pipelines by integrating contextual insights from LLMs with multi-model
similarity knowledge. Across 6 public benchmark datasets, extensive
testing of 760 distinct predictive pipelines including 8 standalone LLM-
based, 112 similarity knowledge-Driven, and 640 hybrid LLM contextual
and similarity Knowledge-Driven demonstrates that hybrid predictive
pipelines consistently outperforms other two types predictive pipelines in
accurately identifying duplicate and conflicting requirements. This pre-
dictive pipeline outperformed existing state-of-the-art predictors perfor-
mance with an overall performance margin of 13% in terms of F1-score."
51;"LePB-SA4RE: A Lexicon-Enhanced and Prompt-Tuning BERT
Model for Evolving Requirements Elicitation from App Reviews";MDPI;2025;"Pre-trained language models with fine-tuning (FT) have achieved notable success
in aspect-based sentiment analysis (ABSA) for automatic requirements elicitation from app
reviews. However, the fixed parameters during FT progress often face challenges when
applied to low-resource and noisy app review scenarios. Although prompt-tuning (PT) has
gained attention in ABSA for its flexibility and adaptability, this improved performance
can sometimes reduce the generalization and robustness of pre-trained models. To mitigate
these issues, this study introduces LePB-SA4RE, a novel ABSA model that integrates
the Bidirectional Encoder Representations from Transformers (BERT) architecture with a
hard template-based PT method and embeds a lexicon-enhanced dynamic modulation
layer. Specifically, the activation function of this layer incorporates weights designed
with sentiment-oriented dynamic parameters to enhance the sensitivity of the model to
diverse sentiment inputs, and a sentiment lexicon containing three hundred thousand word–
sentiment polarity pairs is embedded into the model as additional semantic cues to increase
prediction accuracy. The model retains the stability benefits of Hard-prompt methods while
increasing the flexibility and adaptability necessary for ABSA in requirements elicitation
from app reviews. Experimental results indicate that the proposed method surpasses state-
of-the-art methods on the benchmark datasets, and the generalization of the model achieved
the highest relative improvements of 72% and 36.6% under low-resource data settings and
simulated noisy conditions. These promising findings suggest that LePB-SA4RE has the
potential to provide an effective requirements elicitation solution for user-centric software
evolution and maintenance."
52;"Evaluating Generative Language Models with
Prompt Engineering for Categorizing User Stories
to its Sector Domains";I2CT;2024;"In Agile software development, user stories capture
requirements through a concise, user-centric approach. Manual
categorization of these stories is both labor-intensive and error-
prone. This study addresses the gap in existing research by
exploring the application of generative language models, specifi-
cally GPT-style models, with prompt engineering for user story
categorization.
Our research introduces experiments utilizing two genera-
tive language models, gpt-3.5-turbo and Llama-2-chat-hf, em-
phasizing innovative prompt engineering. The evaluation of
gpt-3.5-turbo and Llama-2-chat-hf demonstrates commendable
performance in zero-shot experiments. Notably, gpt-3.5-turbo
outperforms in few-shot prompting with a higher F-score of
67.93%. The gpt-3.5-turbo showcased superior compliance with
instructions compared to Llama-2-chat-hf. The study underscores
the promising capability of generative language models, with
prompt engineering, to automate user story categorization ef-
fectively.
This work contributes to the potential of automating user
story categorization in low-resource settings, showcasing how
leveraging LLMs can enhance accuracy and streamline the cat-
egorization process in software development, ultimately leading
to more efficient outcomes."