Paper no;Paper name;Venue;Year;Abstract
18;"Agile Methodology for the Standardization of Engineering
Requirements Using Large Language Models";SE;2023;"The increased complexity of modern systems is calling for an integrated and comprehensive
approach to system design and development and, in particular, a shift toward Model-Based
Systems Engineering (MBSE) approaches for system design. The requirements that serve as the
foundation for these intricate systems are still primarily expressed in Natural Language (NL), which
can contain ambiguities and inconsistencies and suffer from a lack of structure that hinders their
direct translation into models. The colossal developments in the field of Natural Language Processing
(NLP), in general, and Large Language Models (LLMs), in particular, can serve as an enabler for
the conversion of NL requirements into machine-readable requirements. Doing so is expected to
facilitate their standardization and use in a model-based environment. This paper discusses a twofold
strategy for converting NL requirements into machine-readable requirements using language
models. The first approach involves creating a requirements table by extracting information from
free-form NL requirements. The second approach consists of an agile methodology that facilitates the
identification of boilerplate templates for different types of requirements based on observed linguistic
patterns. For this study, three different LLMs are utilized. Two of these models are fine-tuned versions
of Bidirectional Encoder Representations from Transformers (BERTs), specifically, aeroBERT-NER
and aeroBERT-Classifier, which are trained on annotated aerospace corpora. Another LLM, called
flair/chunk-english, is utilized to identify sentence chunks present in NL requirements. All three
language models are utilized together to achieve the standardization of requirements. The effectiveness
of the methodologies is demonstrated through the semi-automated creation of boilerplates for
requirements from Parts 23 and 25 of Title 14 Code of Federal Regulations (CFRs)."
19;"Improving requirements completeness: automated assistance
through large language models";REJ;2024;"Natural language (NL) is arguably the most prevalent medium for expressing systems and software requirements. Detecting
incompleteness in NL requirements is a major challenge. One approach to identify incompleteness is to compare requirements
with external sources. Given the rise of large language models (LLMs), an interesting question arises: Are LLMs
useful external sources of knowledge for detecting potential incompleteness in NL requirements? This article explores this
question by utilizing BERT. Specifically, we employ BERT’s masked language model to generate contextualized predictions
for filling masked slots in requirements. To simulate incompleteness, we withhold content from the requirements and assess
BERT’s ability to predict terminology that is present in the withheld content but absent in the disclosed content. BERT can
produce multiple predictions per mask. Our first contribution is determining the optimal number of predictions per mask,
striking a balance between effectively identifying omissions in requirements and mitigating noise present in the predictions.
Our second contribution involves designing a machine learning-based filter to post-process BERT’s predictions and further
reduce noise. We conduct an empirical evaluation using 40 requirements specifications from the PURE dataset. Our findings
indicate that: (1)""BERT’s predictions effectively highlight terminology that is missing from requirements, (2)""BERT outperforms
simpler baselines in identifying relevant yet missing terminology, and (3)""our filter reduces noise in the predictions,
enhancing BERT’s effectiveness for completeness checking of requirements."
20;"PRCBERT: Prompt Learning for Requirement Classification using
BERT-based Pretrained Language Models";ASE;2023;"Software requirement classification is a longstanding and important
problem in requirement engineering. Previous studies have
applied various machine learning techniques for this problem, including
Support Vector Machine (SVM) and decision trees. With
the recent popularity of NLP technique, the state-of-the-art approach
NoRBERT utilizes the pre-trained language model BERT and
achieves a satisfactory performance. However, the dataset PROMISE
used by the existing approaches for this problem consists of only
hundreds of requirements that are outdated according to today’s
technology and market trends. Besides, the NLP technique applied
in these approaches might be obsolete. In this paper, we propose
an approach of prompt learning for requirement classification using
BERT-based pretrained language models (PRCBERT), which
applies flexible prompt templates to achieve accurate requirements
classi!cation. Experiments conducted on two existing small-size requirement
datasets (PROMISE and NFR-REVIEW) and our collected
large-scale requirement dataset NFR-SO prove that PRCBERT exhibits
moderately better classi!cation performance than NoRBERT
and MLM-BERT (BERT with the standard prompt template). On
the de-labeled NFR-REVIEW""% and NFR-SO datasets, Trans_PRCBERT
(the version of PRCBERT which is !ne-tuned on PROMISE) is able
to have a satisfactory zero-shot performance with 53.27% and 72.96%
F1-score when enabling a self-learning strategy."
21;"Requirements Modeling Aided by ChatGPT: An
Experience in Embedded Systems";REW;2023;"Requirements modeling is a crucial tool for requirements
analysis and has been demonstrated to aid in the comprehension
and analysis of requirements. However, constructing
requirements models from natural language descriptions in user
requirements documents can be a time-consuming task. With
the growing attention given to large language models, they have
become an integral component of natural language processing.
Consequently, utilizing large language models to facilitate the
construction of high-quality requirement models is appealing.
This paper presents an automated framework for requirement
model generation that incorporates ChatGPT-based zero-shot
learning to extract requirement models from requirement texts
and subsequently compose them using predefined rules. The
framework defines the requirement extraction task of ChatGPT
by designing appropriate prompt, and it generates requirement
models by employing composition rules. Furthermore, a case
study on a digital home system is conducted to validate the
feasibility of the framework in assisting requirements modeling."
22;"The Current Challenges of So!ware Engineering in the Era of
Large Language Models";Arxiv;2024;"With the advent of large language models (LLMs) in the arti!cial intelligence (AI) area, the field of software
engineering (SE) has also witnessed a paradigm shift. These models, by leveraging the power of deep learning
and massive amounts of data, have demonstrated an unprecedented capacity to understand, generate, and
operate programming languages. They can assist developers in completing a broad spectrum of software
development activities, encompassing software design, automated programming, and maintenance, which
potentially reduces huge human efforts. Integrating LLMs within the SE landscape (LLM4SE) has become a
burgeoning trend, necessitating exploring this emergent landscape’s challenges and opportunities.
The paper aims at revisiting the software development life cycle (SDLC) under LLMs, and highlighting
challenges and opportunities of the new paradigm. The paper !rst summarizes the overall process of LLM4SE,
and then elaborates on the current challenges based on a through discussion. The discussion was held among
more than 20 participants from academia and industry, specializing in fields such as software engineering
and artifcial intelligence. Speci!cally, we achieve 26 key challenges from seven aspects, including software
requirement & design, coding assistance, testing code generation, code review, code maintenance, software
vulnerability management, and data, training, and evaluation. We hope the achieved challenges would benefit
future research in the LLM4SE field."
23;"Using LLMs for Use Case Modelling of IoT Systems:
An Experience Report";MODELS;2024;"Requirements engineering (RE) plays an essential role in the success
of system and software development. Textual use case models are
valuable for capturing diverse scenarios describing the interactions
between the system and its actors, but their development, particularly
for the Internet of Things (IoT), can be tedious and error-prone
due to the added complexities and heterogeneous nature of such systems.
Automating requirements elicitation and specification tasks
with the use of generative AI is highly desirable. This paper explores
the potential of large language models (LLMs) for generating interaction
models for IoT systems from informal problem descriptions.
We investigate the capabilities of OpenAI’s GPT-4 and Google’s
Gemini for generating standard and UCM4IoT textual use cases
by carrying out a comparative study using four IoT applications.
While both of these LLMs show promise as supporting tools, our
findings indicate a need for further refinement and domain-speci!c
training to enhance their precision and reliability in requirements
development for the IoT domain."
24;"Chapter 11: Legal Requirements Analysis: A
Regulatory Compliance Perspective";Arxiv;2024;"Modern software has been an integral part of everyday activities
in many disciplines and application contexts. Introducing intelligent
automation by leveraging artificial intelligence (AI) led to breakthroughs
in many fields. The e!ectiveness of AI can be attributed to
several factors, among which is the increasing availability of data. Regulations
such as the general data protection regulation (GDPR) in the
European Union (EU) are introduced to ensure the protection of personal
data. Software systems that collect, process, or share personal data
are subject to compliance with such regulations. Developing compliant
software depends heavily on addressing legal requirements stipulated in
applicable regulations, a central activity in the requirements engineering
(RE) phase of the software development process. RE is concerned with
specifying and maintaining requirements of a system-to-be, including legal
requirements. Legal agreements which describe the policies organizations
implement for processing personal data can provide an additional
source to regulations for eliciting legal requirements. In this chapter, we
explore a variety of methods for analyzing legal requirements and exemplify
them on GDPR. Specifically, we describe possible alternatives
for creating machine-analyzable representations from regulations, survey
the existing automated means for enabling compliance verification
against regulations, and further reflect on the current challenges of legal
requirements analysis."
25;"Can AI Help with the Formalization of Railway
Cybersecurity Requirements?";ISoLA;2024;"Driven by and dependent on ICT, like almost everything
today, railway transportation has become a critical infrastructure and,
as such, is exposed to threats against communication of on-board and
wayside components. The shift to cybersecurity brings up the need to
comply with new security requirements, and once more security software
engineers are confronted with a well-known problem: how to express informal
requirements into unambiguous formal expressions that can be
translated into enforceable policies or be used to verify the security of
a system design. We have experience in translating natural language requirements
from standards, regulations, and guidelines into Controlled
Natural Language for Data Sharing Agreements (CNL4DSA), a formalism
that serves the purpose of bridging natural and formal expressions.
The translation of requirements is challenging, calling for a rigorous process
of coding agreement between researchers. Following the trend of the
time, in this paper, we question whether AI and, in particular, the novel
Generative Language Models, can help us with this translation exercise.
Previous work shows that AI can help in writing security code, although
not always producing secure code; less studied is the quality of generative
AI’s working with controlled natural languages in writing requirements
for security compliance. Can AI be a valuable tool or companion in this
endeavour too? To answer this question, we engage ChatGPT and Microsoft
365 Copilot with the same challenges that we faced when translating
cybersecurity requirements for railway systems into CNL4DSA.
Comparing our results from some time ago with those of the machine,
we found surprising insights, showing the high potentiality of using AI
in requirements engineering."
26;"Model Generation with LLMs:
from Requirements to UML Sequence Diagram";REW;2024;"Complementing natural language (NL) requirements
with graphical models can improve stakeholders’ communication
and provide directions for system design. However,
creating models from requirements involves manual effort. The
advent of generative large language models (LLMs), ChatGPT
being a notable example, offers promising avenues for automated
assistance in model generation. This paper investigates the capability
of ChatGPT to generate a specific type of model, i.e., UML
sequence diagrams, from NL requirements. We conduct a qualitative
study in which we examine the sequence diagrams generated
by ChatGPT for 28 requirements documents of various types and
from different domains. Observations from the analysis of the
generated diagrams have systematically been captured through
evaluation logs, and categorized through thematic analysis. Our
results indicate that, although the models generally conform to
the standard and exhibit a reasonable level of understandability,
their completeness and correctness with respect to the specified
requirements often present challenges. This issue is particularly
pronounced in the presence of requirements smells, such as
ambiguity and inconsistency. The insights derived from this study
can influence the practical utilization of LLMs in the RE process,
and open the door to novel RE-specific prompting strategies
targeting effective model generation."
27;"Toward Regulatory Compliance: A few-shot
Learning Approach to Extract Processing Activities";REW;2024;"The widespread use of mobile applications has
driven the growth of the industry, with companies relying
heavily on user data for services like targeted advertising and
personalized offerings. In this context, privacy regulations such as
the General Data Protection Regulation (GDPR) play a crucial
role. One of the GDPR requirements is the maintenance of a
Record of Processing Activities (RoPA) by companies. RoPA
encompasses various details, including the description of data
processing activities, their purposes, types of data involved, and
other relevant external entities. Small app-developing companies
face challenges in meeting such compliance requirements due to
resource limitations and tight timelines. To aid these developers
and prevent fines, we propose a method to generate segments of
RoPA from user-authored usage scenarios using large language
models (LLMs). Our method employs few-shot learning with
GPT-3.5 Turbo to summarize usage scenarios and generate RoPA
segments. We evaluate different factors that can affect fewshot
learning performance consistency for our summarization
task, including the number of examples in few-shot learning
prompts, repetition, and order permutation of examples in the
prompts. Our findings highlight the significant influence of the
number of examples in prompts on summarization F1 scores,
while demonstrating negligible variability in F1 scores across
multiple prompt repetitions. Our prompts achieve successful
summarization of processing activities with an average 70%
ROUGE-L F1 score. Finally, we discuss avenues for improving
results through manual evaluation of the generated summaries."
28;"Advancing Requirements Engineering through
Generative AI: Assessing the Role of LLMs";SpringerNature;2024;"Requirements Engineering (RE) is a critical phase in software development
including the elicitation, analysis, specification, and validation of software
requirements. Despite the importance of RE, it remains a challenging process due to
the complexities of communication, uncertainty in the early stages, and inadequate
automation support. In recent years, large language models (LLMs) have shown
significant promise in diverse domains, including natural language processing,
code generation, and program understanding. This chapter explores the potential
of LLMs in driving RE processes, aiming to improve the efficiency and accuracy
of requirements-related tasks. We propose key directions and SWOT analysis for
research and development in using LLMs for RE, focusing on the potential for
requirements elicitation, analysis, specification, and validation. We further present
the results from a preliminary evaluation, in this context."
29;MUCE: a multilingual use case model extractor using GPT-3;IJIT;2022;"During the software requirement specification,
the use case-based approach is used for requirements
elicitation and analysis, for object-oriented software
development. For identifying the use cases, traditionally,
manual approach is used. Though some researchers have
used semi-automated NLP techniques but it requires each
word in a sentence to be tagged with its part-of-speech. In
this paper, we exploit Generative Pre-trained Transformer-
3 (GPT-3) for identifying the use case model by parsing the
given software requirements. GPT-3 is an autoregressive
language model that uses deep learning to produce humanlike
text. It is a language prediction model that can be tuned
with Few-Shot learning to extract functional requirements
in a multilingual setting. We present MUCE, a Multilingual
Use Case model Extractor tool for the extraction of use
cases, actors and their relationships from the given users’
software requirements. Further, not all requirement documents
are English-centric and might be written in some
native language. In such scenario, an automated, multilingual
tool for structuring the use case model will really be a
boon. The benefit of such an automated tool is that it helps
in extracting use cases model as requirements specification
quickly; overcoming the worries involved in manual ways.
This tool can also prove to be a feedback to improve and
fine-tune functional requirements so as to make them more
complete. We evaluated the performance of our tool using
Confusion Matrix. We authenticate our findings by validating
various user requirements case studies written in
different languages particularly, English, Spanish and
French. Our tool performs better than existing state-of-theart
use case model extraction techniques. Our research
endeavor will assist software designers and architects to
generate actors and use cases instantaneously from the
given users’ software requirement documents, and save
their time."
30;"An Automated Model of Software Requirement
Engineering Using GPT-3.5";ICETSIS;2024;While the potential of AI in software development is undeniable, integrating advanced models like GPT-3.5 into its core processes like requirements engineering remains largely unexplored. This research investigates the effectiveness of GPT-3.5 in automating key tasks within software requirements engineering. The primary objective is to comprehensively explore the capabilities, limitations, and potential applications of GPT-3.5 in software requirements engineering. Subsequently, the research undergoes thorough analysis and evaluation to gather insights into the strengths and limitations of GPT-3.5 in the requirement-gathering process. The research concludes by identifying the limitations and putting forth recommendations for future research endeavours aimed at integrating GPT-3.5 into software requirement engineering processes. While GPT-3.5 demonstrates proficiency in aspects like creative prototyping and question generation, limitations in areas like domain understanding and context awareness become evident. By outlining these limitations, the authors offer concrete recommendations for future research focusing on the seamless integration of GPT-3.5 and similar models into the broader framework of software requirements engineering.
31;"Exploring Requirements Elicitation from App Store
User Reviews Using Large Language Models";Arxiv;2024;"Mobile applications have become indispensable companions
in our daily lives. Spanning over the categories from
communication and entertainment to healthcare and finance,
these applications have been influential in every aspect. Despite
their omnipresence, developing apps that meet user needs and
expectations still remains a challenge. Traditional requirements
elicitation methods like user interviews can be time-consuming
and suffer from limited scope and subjectivity. This research
introduces an approach leveraging the power of Large Language
Models (LLMs) to analyze user reviews for automated
requirements elicitation. We fine-tuned three well-established
LLMs BERT, DistilBERT, and GEMMA, on a dataset of app
reviews labeled for usefulness. Our evaluation revealed BERT’s
superior performance, achieving an accuracy of 92.40% and an
F1-score of 92.39%, demonstrating its effectiveness in accurately
classifying useful reviews. While GEMMA displayed a lower
overall performance, it excelled in recall (93.39%), indicating
its potential for capturing a comprehensive set of valuable user
insights. These findings suggest that LLMs offer a promising
avenue for streamlining requirements elicitation in mobile app
development, leading to the creation of more user-centric and
successful applications."
32;"Empirical Evaluation of ChatGPT on Requirements
Information Retrieval Under Zero-Shot Setting";Arxiv;2023;"Recently, various illustrative examples have shown the impressive
ability of generative large language models (LLMs)
to perform NLP related tasks. ChatGPT undoubtedly is the
most representative model. We empirically evaluate Chat-
GPT’s performance on requirements information retrieval
(IR) tasks to derive insights into designing or developing
more e!ective requirements retrievalmethods or tools based
on generative LLMs. We design an evaluation framework
considering four di!erent combinations of two popular IR
tasks and two common artifact types. Under zero-shot setting,
evaluation results reveal ChatGPT’s promising ability
to retrieve requirements relevant information (high recall)
and limited ability to retrieve more specific requirements
information (low precision). Our evaluation of ChatGPT on
requirements IR under zero-shot setting provides preliminary
evidence for designing or developing more e!ective
requirements IR methods or tools based on LLMs."
33;"Towards the LLM-Based Generation of Formal
Specifications from Natural-Language Contracts:
Early Experiments with SYMBOLEO";Arxiv;2024;"Over the past decade, different domain-specific languages
(DSLs) were proposed to formally specify requirements
stated in legal contracts, mainly for analysis but also for code
generation. SYMBOLEO is a promising language in that area.
However, writing formal specifications from natural-language
contracts is a complex task, especial for legal experts who do
not have formal language expertise. This paper reports on an
exploratory experiment targeting the automated generation of
SYMBOLEO specifications from business contracts in English
using Large Language Models (LLMs). Combinations (38) of
prompt components are investigated (with/without the grammar,
semantics explanations, 0 to 3 examples, and emotional prompts),
mainly on GPT-4o but also to a lesser extent on 4 other LLMs.
The generated specifications are manually assessed against 16
error types grouped into 3 severity levels. Early results on all
LLMs show promising outcomes (even for a little-known DSL)
that will likely accelerate the specification of legal contracts. However,
several observed issues, especially around grammar/syntax
adherence and environment variable identification (49%), suggest
many areas where potential improvements should be investigated."
34;"Large Language Models for Software Engineering:
A Systematic Literature Review";SEM;2024;"Large Language Models (LLMs) have significantly impacted numerous domains, including Software Engineering
(SE). Many recent publications have explored LLMs applied to various SE tasks. Nevertheless, a
comprehensive understanding of the application, effects, and possible limitations of LLMs on SE is still in
its early stages. To bridge this gap, we conducted a Systematic Literature Review (SLR) on LLM4SE, with
a particular focus on understanding how LLMs can be exploited to optimize processes and outcomes. We
selected and analyzed 395 research articles from January 2017 to January 2024 to answer four key Research
Questions (RQs). In RQ1, we categorize different LLMs that have been employed in SE tasks, characterizing
their distinctive features and uses. In RQ2, we analyze the methods used in data collection, pre-processing and application, highlighting the role of well-curated datasets for successful LLM for SE implementation.
RQ3 investigates the strategies employed to optimize and evaluate the performance of LLMs in SE. Finally,
RQ4 examines the specific SE tasks where LLMs have shown success to date, illustrating their practical
contributions to the field. From the answers to these RQs, we discuss the current state-of-the-art and trends,
identifying gaps in existing research, and highlighting promising areas for future study."
